[
  {
    "id": "a1",
    "name": "Genetic Apex",
    "release_date": "2024-10-30",
    "total_cards": 286,
    "cards_url": "https://raw.githubusercontent.com/chase-manning/pokemon-tcg-pocket-cards/refs/heads/main/data/v5/a1/a1.json",
    "cards_url_min": "https://raw.githubusercontent.com/chase-manning/pokemon-tcg-pocket-cards/refs/heads/main/data/v5/a1/a1.min.json",
    "packs": [
      {
        "id": "a1-charizard",
        "name": "Charizard",
        "image": "https://raw.githubusercontent.com/chase-manning/pokemon-tcg-pocket-cards/refs/heads/main/images/webp/packs/a1-charizard.webp",
        "image_png": "https://raw.githubusercontent.com/chase-manning/pokemon-tcg-pocket-cards/refs/heads/main/images/png/packs/a1-charizard.png"
      },
      {
        "id": "a1-mewtwo",
        "name": "Mewtwo",
        "image": "https://raw.githubusercontent.com/chase-manning/pokemon-tcg-pocket-cards/refs/heads/main/images/webp/packs/a1-mewtwo.webp",
        "image_png": "https://raw.githubusercontent.com/chase-manning/pokemon-tcg-pocket-cards/refs/heads/main/images/png/packs/a1-mewtwo.png"
      },
      {
        "id": "a1-pikachu",
        "name": "Pikachu",
        "image": "https://raw.githubusercontent.com/chase-manning/pokemon-tcg-pocket-cards/refs/heads/main/images/webp/packs/a1-pikachu.webp",
        "image_png": "https://raw.githubusercontent.com/chase-manning/pokemon-tcg-pocket-cards/refs/heads/main/images/png/packs/a1-pikachu.png"
      }
    ],
    "cards_core_url": "https://raw.githubusercontent.com/chase-manning/pokemon-tcg-pocket-cards/refs/heads/main/data/v5/a1/a1.core.json",
    "cards_core_url_min": "https://raw.githubusercontent.com/chase-manning/pokemon-tcg-pocket-cards/refs/heads/main/data/v5/a1/a1.core.min.json",
    "cards_core_no_image_url": "https://raw.githubusercontent.com/chase-manning/pokemon-tcg-pocket-cards/refs/heads/main/data/v5/a1/a1.core.no-image.json",
    "cards_core_no_image_url_min": "https://raw.githubusercontent.com/chase-manning/pokemon-tcg-pocket-cards/refs/heads/main/data/v5/a1/a1.core.no-image.min.json",
    "cards_gameplay_url": "https://raw.githubusercontent.com/chase-manning/pokemon-tcg-pocket-cards/refs/heads/main/data/v5/a1/a1.gameplay.json",
    "cards_gameplay_url_min": "https://raw.githubusercontent.com/chase-manning/pokemon-tcg-pocket-cards/refs/heads/main/data/v5/a1/a1.gameplay.min.json",
    "cards_gameplay_no_image_url": "https://raw.githubusercontent.com/chase-manning/pokemon-tcg-pocket-cards/refs/heads/main/data/v5/a1/a1.gameplay.no-image.json",
    "cards_gameplay_no_image_url_min": "https://raw.githubusercontent.com/chase-manning/pokemon-tcg-pocket-cards/refs/heads/main/data/v5/a1/a1.gameplay.no-image.min.json",
    "cards_collection_url": "https://raw.githubusercontent.com/chase-manning/pokemon-tcg-pocket-cards/refs/heads/main/data/v5/a1/a1.collection.json",
    "cards_collection_url_min": "https://raw.githubusercontent.com/chase-manning/pokemon-tcg-pocket-cards/refs/heads/main/data/v5/a1/a1.collection.min.json",
    "cards_collection_no_image_url": "https://raw.githubusercontent.com/chase-manning/pokemon-tcg-pocket-cards/refs/heads/main/data/v5/a1/a1.collection.no-image.json",
    "cards_collection_no_image_url_min": "https://raw.githubusercontent.com/chase-manning/pokemon-tcg-pocket-cards/refs/heads/main/data/v5/a1/a1.collection.no-image.min.json"
  },
  {
    "id": "a1a",
    "name": "Mythical Island",
    "release_date": "2024-12-17",
    "total_cards": 86,
    "cards_url": "https://raw.githubusercontent.com/chase-manning/pokemon-tcg-pocket-cards/refs/heads/main/data/v5/a1a/a1a.json",
    "cards_url_min": "https://raw.githubusercontent.com/chase-manning/pokemon-tcg-pocket-cards/refs/heads/main/data/v5/a1a/a1a.min.json",
    "packs": [
      {
        "id": "a1a-mew",
        "name": "Mew",
        "image": "https://raw.githubusercontent.com/chase-manning/pokemon-tcg-pocket-cards/refs/heads/main/images/webp/packs/a1a-mew.webp",
        "image_png": "https://raw.githubusercontent.com/chase-manning/pokemon-tcg-pocket-cards/refs/heads/main/images/png/packs/a1a-mew.png"
      }
    ],
    "cards_core_url": "https://raw.githubusercontent.com/chase-manning/pokemon-tcg-pocket-cards/refs/heads/main/data/v5/a1a/a1a.core.json",
    "cards_core_url_min": "https://raw.githubusercontent.com/chase-manning/pokemon-tcg-pocket-cards/refs/heads/main/data/v5/a1a/a1a.core.min.json",
    "cards_core_no_image_url": "https://raw.githubusercontent.com/chase-manning/pokemon-tcg-pocket-cards/refs/heads/main/data/v5/a1a/a1a.core.no-image.json",
    "cards_core_no_image_url_min": "https://raw.githubusercontent.com/chase-manning/pokemon-tcg-pocket-cards/refs/heads/main/data/v5/a1a/a1a.core.no-image.min.json",
    "cards_gameplay_url": "https://raw.githubusercontent.com/chase-manning/pokemon-tcg-pocket-cards/refs/heads/main/data/v5/a1a/a1a.gameplay.json",
    "cards_gameplay_url_min": "https://raw.githubusercontent.com/chase-manning/pokemon-tcg-pocket-cards/refs/heads/main/data/v5/a1a/a1a.gameplay.min.json",
    "cards_gameplay_no_image_url": "https://raw.githubusercontent.com/chase-manning/pokemon-tcg-pocket-cards/refs/heads/main/data/v5/a1a/a1a.gameplay.no-image.json",
    "cards_gameplay_no_image_url_min": "https://raw.githubusercontent.com/chase-manning/pokemon-tcg-pocket-cards/refs/heads/main/data/v5/a1a/a1a.gameplay.no-image.min.json",
    "cards_collection_url": "https://raw.githubusercontent.com/chase-manning/pokemon-tcg-pocket-cards/refs/heads/main/data/v5/a1a/a1a.collection.json",
    "cards_collection_url_min": "https://raw.githubusercontent.com/chase-manning/pokemon-tcg-pocket-cards/refs/heads/main/data/v5/a1a/a1a.collection.min.json",
    "cards_collection_no_image_url": "https://raw.githubusercontent.com/chase-manning/pokemon-tcg-pocket-cards/refs/heads/main/data/v5/a1a/a1a.collection.no-image.json",
    "cards_collection_no_image_url_min": "https://raw.githubusercontent.com/chase-manning/pokemon-tcg-pocket-cards/refs/heads/main/data/v5/a1a/a1a.collection.no-image.min.json"
  },
  {
    "id": "a2",
    "name": "Space-Time Smackdown",
    "release_date": "2025-01-29",
    "total_cards": 207,
    "cards_url": "https://raw.githubusercontent.com/chase-manning/pokemon-tcg-pocket-cards/refs/heads/main/data/v5/a2/a2.json",
    "cards_url_min": "https://raw.githubusercontent.com/chase-manning/pokemon-tcg-pocket-cards/refs/heads/main/data/v5/a2/a2.min.json",
    "packs": [
      {
        "id": "a2-dialga",
        "name": "Dialga",
        "image": "https://raw.githubusercontent.com/chase-manning/pokemon-tcg-pocket-cards/refs/heads/main/images/webp/packs/a2-dialga.webp",
        "image_png": "https://raw.githubusercontent.com/chase-manning/pokemon-tcg-pocket-cards/refs/heads/main/images/png/packs/a2-dialga.png"
      },
      {
        "id": "a2-palkia",
        "name": "Palkia",
        "image": "https://raw.githubusercontent.com/chase-manning/pokemon-tcg-pocket-cards/refs/heads/main/images/webp/packs/a2-palkia.webp",
        "image_png": "https://raw.githubusercontent.com/chase-manning/pokemon-tcg-pocket-cards/refs/heads/main/images/png/packs/a2-palkia.png"
      }
    ],
    "cards_core_url": "https://raw.githubusercontent.com/chase-manning/pokemon-tcg-pocket-cards/refs/heads/main/data/v5/a2/a2.core.json",
    "cards_core_url_min": "https://raw.githubusercontent.com/chase-manning/pokemon-tcg-pocket-cards/refs/heads/main/data/v5/a2/a2.core.min.json",
    "cards_core_no_image_url": "https://raw.githubusercontent.com/chase-manning/pokemon-tcg-pocket-cards/refs/heads/main/data/v5/a2/a2.core.no-image.json",
    "cards_core_no_image_url_min": "https://raw.githubusercontent.com/chase-manning/pokemon-tcg-pocket-cards/refs/heads/main/data/v5/a2/a2.core.no-image.min.json",
    "cards_gameplay_url": "https://raw.githubusercontent.com/chase-manning/pokemon-tcg-pocket-cards/refs/heads/main/data/v5/a2/a2.gameplay.json",
    "cards_gameplay_url_min": "https://raw.githubusercontent.com/chase-manning/pokemon-tcg-pocket-cards/refs/heads/main/data/v5/a2/a2.gameplay.min.json",
    "cards_gameplay_no_image_url": "https://raw.githubusercontent.com/chase-manning/pokemon-tcg-pocket-cards/refs/heads/main/data/v5/a2/a2.gameplay.no-image.json",
    "cards_gameplay_no_image_url_min": "https://raw.githubusercontent.com/chase-manning/pokemon-tcg-pocket-cards/refs/heads/main/data/v5/a2/a2.gameplay.no-image.min.json",
    "cards_collection_url": "https://raw.githubusercontent.com/chase-manning/pokemon-tcg-pocket-cards/refs/heads/main/data/v5/a2/a2.collection.json",
    "cards_collection_url_min": "https://raw.githubusercontent.com/chase-manning/pokemon-tcg-pocket-cards/refs/heads/main/data/v5/a2/a2.collection.min.json",
    "cards_collection_no_image_url": "https://raw.githubusercontent.com/chase-manning/pokemon-tcg-pocket-cards/refs/heads/main/data/v5/a2/a2.collection.no-image.json",
    "cards_collection_no_image_url_min": "https://raw.githubusercontent.com/chase-manning/pokemon-tcg-pocket-cards/refs/heads/main/data/v5/a2/a2.collection.no-image.min.json"
  },
  {
    "id": "a2a",
    "name": "Triumphant Light",
    "release_date": "2025-02-28",
    "total_cards": 96,
    "cards_url": "https://raw.githubusercontent.com/chase-manning/pokemon-tcg-pocket-cards/refs/heads/main/data/v5/a2a/a2a.json",
    "cards_url_min": "https://raw.githubusercontent.com/chase-manning/pokemon-tcg-pocket-cards/refs/heads/main/data/v5/a2a/a2a.min.json",
    "packs": [
      {
        "id": "a2a-arceus",
        "name": "Arceus",
        "image": "https://raw.githubusercontent.com/chase-manning/pokemon-tcg-pocket-cards/refs/heads/main/images/webp/packs/a2a-arceus.webp",
        "image_png": "https://raw.githubusercontent.com/chase-manning/pokemon-tcg-pocket-cards/refs/heads/main/images/png/packs/a2a-arceus.png"
      }
    ],
    "cards_core_url": "https://raw.githubusercontent.com/chase-manning/pokemon-tcg-pocket-cards/refs/heads/main/data/v5/a2a/a2a.core.json",